[
  {
    "type": "voronoi",
    "coordinates_2d": [
      0.2839252786111226,
      -11.005093588840127
    ],
    "coordinates_highD": null,
    "desert_value": 4.9960113196475815,
    "nearest_concepts": [
      {
        "term": "rostroid",
        "distance": 4.9960113196475815,
        "roget_categories": [
          "Curvature"
        ],
        "roget_class": "Space"
      },
      {
        "term": "necessities",
        "distance": 4.9960113196475815,
        "roget_categories": [
          "Requirement"
        ],
        "roget_class": "Volition"
      },
      {
        "term": "coarctation",
        "distance": 4.9960113196475815,
        "roget_categories": [
          "Nonincrease, Decrease"
        ],
        "roget_class": "Abstract Relations"
      }
    ],
    "roget_context": null,
    "generated_description": "This embedding captures the notion of **constriction or bottlenecking under existential pressure**—where necessary constraints force something (material, social, or experiential) through a narrowed passage or reduced state. It&#x27;s the semantic space where scarcity, structural limitation, and unavoidable compression meet.",
    "user_notes": "",
    "fabrication_notes": {
      "material": "",
      "method": "",
      "dimensions": "",
      "status": "idea",
      "photos": []
    },
    "tags": [],
    "starred": false,
    "v1_source": null,
    "id": "434307ea-851b-422d-b6c2-75b5ffe581fc",
    "timestamp": "2026-04-07T00:27:47.283578+00:00",
    "schema_version": 1
  },
  {
    "type": "probe_discovery",
    "coordinates_2d": [
      0.0,
      0.0
    ],
    "coordinates_highD": null,
    "desert_value": 0.8944349402044615,
    "nearest_concepts": [
      {
        "term": "usually",
        "distance": 0.8944349402044615,
        "roget_categories": [
          "5.1.14"
        ],
        "roget_class": "Volition"
      },
      {
        "term": "generally",
        "distance": 0.8972328455907809,
        "roget_categories": [
          "1.4.21"
        ],
        "roget_class": "Abstract Relations"
      },
      {
        "term": "this",
        "distance": 0.9001064777085617,
        "roget_categories": [
          "1.4.22"
        ],
        "roget_class": "Abstract Relations"
      }
    ],
    "roget_context": null,
    "generated_description": "This point captures **habitual or default states that lack full conscious intention**—the space between deliberate choice (&quot;usually&quot; implies frequency without necessity) and mere reference (&quot;this&quot; as pointing). It&#x27;s the realm of *what tends to happen without being willed*, like how you automatically reach for coffee each morning or how a system defaults to a certain mode.",
    "user_notes": "apache vs demanding",
    "fabrication_notes": {
      "material": "",
      "method": "",
      "dimensions": "",
      "status": "idea",
      "photos": []
    },
    "tags": [
      "class_3",
      "class_6",
      "cross_class"
    ],
    "starred": true,
    "v1_source": null,
    "id": "b3d9fc53-8d85-4601-a5c1-236ba8e602cd",
    "timestamp": "2026-04-07T01:01:29.578532+00:00",
    "schema_version": 1
  },
  {
    "type": "probe_discovery",
    "coordinates_2d": [
      0.0,
      0.0
    ],
    "coordinates_highD": null,
    "desert_value": 0.8911413017885951,
    "nearest_concepts": [
      {
        "term": "burst",
        "distance": 0.8911413017885951,
        "roget_categories": [
          "1.3.20"
        ],
        "roget_class": "Abstract Relations"
      },
      {
        "term": "avalanche",
        "distance": 0.8970162912661442,
        "roget_categories": [
          "2.4.42"
        ],
        "roget_class": "Space"
      },
      {
        "term": "jolt",
        "distance": 0.8973610536120201,
        "roget_categories": [
          "2.4.13"
        ],
        "roget_class": "Space"
      }
    ],
    "roget_context": null,
    "generated_description": "This region captures the sudden, overwhelming release of accumulated potential—the moment when threshold is crossed and containment fails, whether as an abrupt shock (jolt), cascading collapse (avalanche), or explosive discharge (burst). It&#x27;s the concept of *rapid phase transition from stability to chaos*.",
    "user_notes": "surge vs overwhelmed",
    "fabrication_notes": {
      "material": "",
      "method": "",
      "dimensions": "",
      "status": "idea",
      "photos": []
    },
    "tags": [
      "class_1",
      "class_5",
      "cross_class"
    ],
    "starred": true,
    "v1_source": null,
    "id": "7d2a043d-4d69-451a-aaa4-60f431071c3a",
    "timestamp": "2026-04-07T01:01:31.616722+00:00",
    "schema_version": 1
  },
  {
    "type": "probe_discovery",
    "coordinates_2d": [
      0.0,
      0.0
    ],
    "coordinates_highD": null,
    "desert_value": 0.8558916711261733,
    "nearest_concepts": [
      {
        "term": "crazy",
        "distance": 0.8558916711261733,
        "roget_categories": [
          "1.8.8"
        ],
        "roget_class": "Abstract Relations"
      },
      {
        "term": "that",
        "distance": 0.8565828632477513,
        "roget_categories": [
          "1.4.22"
        ],
        "roget_class": "Abstract Relations"
      },
      {
        "term": "swim",
        "distance": 0.8567029436083174,
        "roget_categories": [
          "2.4.4"
        ],
        "roget_class": "Space"
      }
    ],
    "roget_context": null,
    "generated_description": "This point captures the cognitive moment of **sudden disorientation or perceptual shift**—when familiar reality becomes unstable enough to question, but before language lands on what&#x27;s wrong. It&#x27;s the gap between &quot;this seems off&quot; and naming the specific wrongness.",
    "user_notes": "pool vs craziness",
    "fabrication_notes": {
      "material": "",
      "method": "",
      "dimensions": "",
      "status": "idea",
      "photos": []
    },
    "tags": [
      "class_3",
      "class_4",
      "cross_class"
    ],
    "starred": true,
    "v1_source": null,
    "id": "dba4e13b-b158-45ff-b8ab-854fa8074c12",
    "timestamp": "2026-04-07T01:01:33.674206+00:00",
    "schema_version": 1
  },
  {
    "type": "probe_discovery",
    "coordinates_2d": [
      0.0,
      0.0
    ],
    "coordinates_highD": null,
    "desert_value": 0.8452095140943556,
    "nearest_concepts": [
      {
        "term": "stellar",
        "distance": 0.8452095140943556,
        "roget_categories": [
          "3.1.3"
        ],
        "roget_class": "Matter"
      },
      {
        "term": "star",
        "distance": 0.8589898651191702,
        "roget_categories": [
          "3.2.1"
        ],
        "roget_class": "Matter"
      },
      {
        "term": "thriving",
        "distance": 0.8595835715278185,
        "roget_categories": [
          "5.5.6"
        ],
        "roget_class": "Volition"
      }
    ],
    "roget_context": null,
    "generated_description": "This is the concept of **abundant scarcity** — something sparse and isolated (stellar/desert) that nonetheless sustains itself vigorously (thriving). Think: an oasis or a lone thriving organism in harsh terrain.",
    "user_notes": "superstar vs thrive",
    "fabrication_notes": {
      "material": "",
      "method": "",
      "dimensions": "",
      "status": "idea",
      "photos": []
    },
    "tags": [
      "class_3",
      "class_5",
      "cross_class"
    ],
    "starred": true,
    "v1_source": null,
    "id": "4e4a03fb-7c12-488a-8151-07309fd7f937",
    "timestamp": "2026-04-07T01:01:35.706599+00:00",
    "schema_version": 1
  },
  {
    "type": "probe_discovery",
    "coordinates_2d": [
      0.0,
      0.0
    ],
    "coordinates_highD": null,
    "desert_value": 0.8410853583157849,
    "nearest_concepts": [
      {
        "term": "usually",
        "distance": 0.8410853583157849,
        "roget_categories": [
          "5.1.14"
        ],
        "roget_class": "Volition"
      },
      {
        "term": "interchange",
        "distance": 0.8449889929750639,
        "roget_categories": [
          "1.2.4"
        ],
        "roget_class": "Abstract Relations"
      },
      {
        "term": "biblical",
        "distance": 0.8493172855269903,
        "roget_categories": [
          "6.5.10"
        ],
        "roget_class": "Affections"
      }
    ],
    "roget_context": null,
    "generated_description": "This is the space of **customary exchange or ritual substitution**—where something normally expected gets swapped out according to established practice, like sacrificial replacement in religious tradition or conventional bartering where goods interchange rather than transfer outright.",
    "user_notes": "swap vs hebrew",
    "fabrication_notes": {
      "material": "",
      "method": "",
      "dimensions": "",
      "status": "idea",
      "photos": []
    },
    "tags": [
      "class_1",
      "class_4",
      "cross_class"
    ],
    "starred": true,
    "v1_source": null,
    "id": "5a70376c-d716-424f-acda-996e26265c3b",
    "timestamp": "2026-04-07T01:01:37.764710+00:00",
    "schema_version": 1
  },
  {
    "type": "probe_discovery",
    "coordinates_2d": [
      0.0,
      0.0
    ],
    "coordinates_highD": null,
    "desert_value": 0.8384198414833671,
    "nearest_concepts": [
      {
        "term": "fairy",
        "distance": 0.8384198414833671,
        "roget_categories": [
          "4.7.2"
        ],
        "roget_class": "Intellect"
      },
      {
        "term": "princess",
        "distance": 0.8419624225239244,
        "roget_categories": [
          "5.6.9"
        ],
        "roget_class": "Volition"
      },
      {
        "term": "dear",
        "distance": 0.864745029817929,
        "roget_categories": [
          "5.9.40"
        ],
        "roget_class": "Volition"
      }
    ],
    "roget_context": null,